{
  "story_path": "docs/reqs/refactor-workflow-modules/fix-dead-dupes/refactor-workflow-modules.analysis.json",
  "repo_state_before_design": "docs/reqs/refactor-workflow-modules/fix-dead-dupes/current-reality.audit.json",
  "workflow_sequence": [
    {
      "step": "1",
      "description": "RefactorPlanLoaded — the maintainer reads gaps.md and the current-reality audit, identifying dead orchestrator modules, missing common hooks, the omitted output-directory instruction, and logging-config wiring gaps.",
      "layers_involved": ["Platform Maintainer", "Repository Configuration"],
      "handshake_points": [
        {
          "from_layer": "Repository Configuration",
          "to_layer": "Platform Maintainer",
          "contract_used": "RefactorGapsDocument",
          "data_shape": "{dead_modules: [repo-relative path, ...], missing_common_behaviors: [string, ...], stale_documentation: [repo-relative path, ...]}"
        }
      ]
    },
    {
      "step": "2",
      "description": "DeadModuleSafetyValidated — static import and architecture scans confirm no external callers import the targeted orchestrator modules, tests, or config files, and that common equivalents cover the live surface.",
      "layers_involved": ["Verification", "Orchestrator Composition", "Common Infrastructure"],
      "handshake_points": [
        {
          "from_layer": "Verification",
          "to_layer": "Orchestrator Composition",
          "contract_used": "DeadModuleSafetyCheck",
          "data_shape": "{candidate_paths: [string, ...], external_callers_found: boolean, common_coverage_status: [string, ...]}"
        }
      ]
    },
    {
      "step": "3",
      "description": "CommonSkillActivityExtended — common/skill_activity.py gains typed no-op hooks, a compatibility run_skill helper, and a build_prompt that appends the output-directory instruction before any modify_prompt hook.",
      "layers_involved": ["Common Infrastructure", "Workflow Module"],
      "handshake_points": [
        {
          "from_layer": "Common Infrastructure",
          "to_layer": "Workflow Module",
          "contract_used": "SkillActivityLifecycle",
          "data_shape": "{execute_hooks: [modify_sentinel_path, modify_prompt (output-dir instruction baked in), modify_harness_config, modify_invocation_context, modify_output_path, modify_result], run_skill: Callable[[SkillActivityInput, *, output_path_key: str, harness: Harness, repo_root: Path, expected_output_path: Callable | None], SkillActivityOutput]}"
        }
      ]
    },
    {
      "step": "4",
      "description": "CommonLoggingSetupPorted — common/workflow_logger.py exposes setup_worker_logging(config) and all log contexts accept an optional WorkflowLoggerConfig; missing or unknown-key configs fall back to safe hardcoded defaults.",
      "layers_involved": ["Common Infrastructure", "Orchestrator Composition"],
      "handshake_points": [
        {
          "from_layer": "Common Infrastructure",
          "to_layer": "Orchestrator Composition",
          "contract_used": "WorkerLoggingSetup",
          "data_shape": "setup_worker_logging(config: WorkflowLoggerConfig | None) -> None; activity_log_context, workflow_log_context, client_log_context accept optional WorkflowLoggerConfig"
        }
      ]
    },
    {
      "step": "5",
      "description": "OrchestratorLoggingConfigWired — orchestrator/worker.py loads src/orchestrator/workflow_logging.config.json into a WorkflowLoggerConfig and passes it to common.setup_worker_logging before the Cadence Worker topology starts.",
      "layers_involved": ["Orchestrator Composition", "Orchestrator Runtime", "Common Infrastructure"],
      "handshake_points": [
        {
          "from_layer": "Orchestrator Composition",
          "to_layer": "Common Infrastructure",
          "contract_used": "OrchestratorLoggingConfig",
          "data_shape": "WorkflowLoggerConfig {log_root: Path, worker_level: str, workflow_level: str, client_level: str, activity_level: str, devin_level: str}"
        }
      ]
    },
    {
      "step": "6",
      "description": "OrchestratorDuplicatesRemoved — the dead orchestrator modules, tests, config files, and stale documentation identified in gaps.md are deleted after common replacements pass tests; a static architecture test rejects any lingering imports.",
      "layers_involved": ["Orchestrator Composition", "Repository Configuration", "Verification"],
      "handshake_points": [
        {
          "from_layer": "Orchestrator Composition",
          "to_layer": "Repository Configuration",
          "contract_used": "DeadModuleRemoval",
          "data_shape": "{removed_paths: [repo-relative path, ...], static_test: 'test_architecture asserts no stale orchestrator imports'}"
        }
      ]
    },
    {
      "step": "7",
      "description": "CommonTestCoverageExpanded — common tests are added for workflow/client contexts, log path helpers, stdout/stderr capture to devin.log, SkillActivityOutput log-path fields, prompt instruction ordering, hook validation, and safe defaults.",
      "layers_involved": ["Verification", "Common Infrastructure"],
      "handshake_points": [
        {
          "from_layer": "Verification",
          "to_layer": "Common Infrastructure",
          "contract_used": "ExpandedCommonTestCoverage",
          "data_shape": "{test_files: [test_workflow_logger.py, test_devin_harness.py, test_skill_activity.py], new_assertions: [workflow_log_context_file_creation, client_log_context_file_creation, get_workflow_log_path, get_client_log_path, stdout_stderr_in_devin_log, activity_log_path/devin_log_path_in_output, output_directory_instruction_before_modify_prompt, safe_defaults_for_missing_config]}"
        }
      ]
    },
    {
      "step": "8",
      "description": "FullRegressionVerified — nix-shell pytest passes for the common, orchestrator, and story_analysis_workflow test suites; unit and end-to-end tests assert the expected log layout, and live full-stack workflow log-tree verification is documented as not available in CI.",
      "layers_involved": ["Verification", "Operations", "Repository Configuration"],
      "handshake_points": [
        {
          "from_layer": "Verification",
          "to_layer": "Operations",
          "contract_used": "RegressionVerification",
          "data_shape": "{pytest_scope: [src/common/tests, src/orchestrator/tests, src/story_analysis_workflow/tests], live_full_stack_log_tree: 'out of CI scope'}"
        }
      ]
    }
  ],
  "instrumentation_events": [
    {
      "event_name": "ConfigureWorkerLogging",
      "description": "Records the orchestrator loading workflow_logging.config.json and calling common.setup_worker_logging.",
      "layers_involved": ["Orchestrator Composition", "Common Infrastructure"],
      "data_points": [
        {"point": "config_path", "description": "Repository-relative path to the orchestrator-owned logging config."},
        {"point": "log_root", "description": "Resolved log root path."},
        {"point": "levels", "description": "Per-category level map."},
        {"point": "fallback_used", "description": "True when the orchestrator did not supply a config object."}
      ]
    },
    {
      "event_name": "ExtendSkillActivityTemplate",
      "description": "Records the common SkillActivity gaining extension hooks and a run_skill helper.",
      "layers_involved": ["Common Infrastructure"],
      "data_points": [
        {"point": "skill_name", "description": "Canonical skill name being executed."},
        {"point": "hooks_present", "description": "List of hook names available on SkillActivity."},
        {"point": "run_skill_present", "description": "True when the compatibility helper is exposed."}
      ]
    },
    {
      "event_name": "BuildSkillPrompt",
      "description": "Records the default prompt construction, including the output-directory instruction before modify_prompt.",
      "layers_involved": ["Common Infrastructure", "Workflow Module"],
      "data_points": [
        {"point": "skill_name", "description": "Canonical skill name."},
        {"point": "output_directory_instruction_present", "description": "True when the instruction is included before the hook."},
        {"point": "prompt_length", "description": "Character count of the final prompt."}
      ]
    },
    {
      "event_name": "InvokeSkillHarness",
      "description": "Records a Harness.run call with the resolved prompt, cwd, and namespaced harness config.",
      "layers_involved": ["Common Infrastructure", "DevinHarness"],
      "data_points": [
        {"point": "skill_name", "description": "Canonical skill name from invocation context."},
        {"point": "permission_mode", "description": "Resolved Devin permission mode."},
        {"point": "model", "description": "Resolved Devin model."},
        {"point": "harness_namespace", "description": "Namespace used from the Activity config, e.g. 'devin'."}
      ]
    },
    {
      "event_name": "CaptureDevinOutput",
      "description": "Records DevinHarness writing stdout and stderr to devin.log regardless of exit code.",
      "layers_involved": ["Common Infrastructure"],
      "data_points": [
        {"point": "skill_name", "description": "Canonical skill name."},
        {"point": "exit_code", "description": "Process exit code."},
        {"point": "stdout_bytes", "description": "Bytes captured from stdout."},
        {"point": "stderr_bytes", "description": "Bytes captured from stderr."},
        {"point": "devin_log_path", "description": "Repository-relative or absolute path to devin.log."}
      ]
    },
    {
      "event_name": "WriteActivityLog",
      "description": "Records activity.log creation and key lifecycle events for a skill invocation.",
      "layers_involved": ["Common Infrastructure"],
      "data_points": [
        {"point": "skill_name", "description": "Canonical skill name."},